{
  "char_id": "quizzy",
  "name": "Quizzy",
  "char_type": "animated_2d",
  "voice_id": "quizzy_v3",
  "aliases": [],
  "outfit_states": [
    {
      "state_id": "default",
      "description": "standard purple visor",
      "primary_colors": [
        "#7c4dff",
        "#f3a712"
      ],
      "histogram": [
        0.18,
        0.1,
        0.08,
        0.07,
        0.06,
        0.06,
        0.07,
        0.08,
        0.08,
        0.07,
        0.07,
        0.08
      ]
    },
    {
      "state_id": "lab_coat",
      "description": "white coat halloween_2026",
      "primary_colors": [
        "#ffffff",
        "#22d3ee"
      ],
      "histogram": [
        0.05,
        0.05,
        0.05,
        0.2,
        0.2,
        0.15,
        0.1,
        0.05,
        0.05,
        0.04,
        0.03,
        0.03
      ]
    }
  ],
  "appearance_notes": "",
  "locked": false,
  "locked_by": "",
  "locked_at": "",
  "locked_until": null,
  "embedding_count": 1,
  "embedding_backend": "phash",
  "signature": "168086f490c48dfbd4427b7be7a97960f40c09fd5f58b3d8b24885ba58f93ade"
}